ticker,company,sector,sub_industry,date,price,change_1m_pct,change_1y_pct,high_52w,low_52w,sma50,sma200,trend,rsi,rsi_status,volatility_pct,market_cap_b,pe_trailing,pe_forward,eps,dividend_yield_pct,roe_pct,debt_to_equity,revenue_b,net_income_b,beta,sentiment_score,news_summary,ai_summary
MMM,3M Company,Industrials,Industrial Conglomerates,2026-03-15,150.96,-12.27,5.23,173.83,123.81,162.15,157.16,Uptrend,26.45,Oversold,30.44,79.51,25.2,16.06,5.99,207.0,75.5,276.64,24.95,3.25,1.13,-0.04,ภาพรวมความเชื่อมั่นต่อหุ้น 3M อยู่ในเกณฑ์ผสมผสานค่อนไปทางลบเล็กน้อย เนื่องจากความกังวลเรื่องผลประกอบการและความไม่แน่นอนทางกฎหมาย แม้จะมีมุมมองเชิงบวกจากการคงคำแนะนำให้ซื้อของนักวิเคราะห์บางรายก็ตาม,"หุ้น MMM มีความน่าสนใจในลักษณะของการหาจังหวะ **""ซื้อเมื่อย่อตัว"" (Buy on Dip)** เนื่องจากภาพรวมระยะยาวยังเป็นแนวโน้มขาขึ้นและมีประสิทธิภาพการทำกำไร (ROE) สูงโดดเด่นถึง 75.5% ในขณะที่ระยะสั้นราคาปรับฐานลงมาจนเข้าสู่ภาวะ Oversold (RSI 26.45) ซึ่งเป็นจุดที่น่าสะสม 

หุ้นตัวนี้จึงเหมาะกับ **นักลงทุนระยะกลางถึงยาวสายเน้นคุณค่า (Value Investor)** ที่สามารถรับความผันผวนได้ระดับหนึ่ง และกำลังมองหาโอกาสเข้าสะสมหุ้นพื้นฐานแข็งแกร่งในจังหวะที่ราคาปรับตัวลดลงมาครับ"
AOS,A. O. Smith Corporation,Industrials,Building Products,2026-03-15,66.84,-16.68,4.21,80.47,58.44,73.49,69.37,Uptrend,16.29,Oversold,24.04,9.24,17.36,15.39,3.85,209.0,29.2,10.97,3.83,0.55,1.3,0.16,ภาพรวมทิศทางข่าวของหุ้น A. O. Smith อยู่ในเกณฑ์เป็นกลางถึงบวกเล็กน้อย เนื่องจากมีปัจจัยสนับสนุนด้านการลงทุนจากสถาบันและผลงานที่เหนือกว่าคู่แข่ง แม้จะเผชิญกับราคาหุ้นที่อ่อนตัวลงเมื่อเร็ว ๆ นี้ก็ตาม,"หุ้น AOS มีความน่าสนใจอย่างมาก เนื่องจากมีปัจจัยพื้นฐานการทำกำไรที่แข็งแกร่ง (ROE สูงถึง 29.2% ในขณะที่ P/E ไม่แพงที่ 17.36) และปัจจุบันราคาปรับฐานระยะสั้นลงมาแรงจนอยู่ในภาวะ Oversold อย่างหนัก (RSI 16.29) ทั้งที่แนวโน้มหลักยังคงเป็นขาขึ้น 

ดังนั้น หุ้นตัวนี้จึงเหมาะทั้งกับ **นักลงทุนเน้นคุณค่า (Value Investor)** ที่ต้องการสะสมหุ้นพื้นฐานดีในราคาถูก และ **นักลงทุนระยะสั้นสายสวิงเทรด** ที่มองหาจังหวะซื้อเก็งกำไรจากการรีบาวด์ (Buy the dip) ครับ"
ABT,Abbott Laboratories,Health Care,Health Care Equipment,2026-03-15,108.03,-4.89,-15.27,136.16,106.05,114.76,125.4,Downtrend,28.62,Oversold,20.83,187.72,29.04,17.3,3.72,233.0,12.96,26.79,44.33,6.5,0.74,-0.14,ภาพรวมทิศทางข่าวของหุ้น Abbott ค่อนข้างเป็นลบเล็กน้อยจากการถูกปรับลดความคาดหวังและผลการดำเนินงานที่ยังไม่ชัดเจนนัก แม้จะมีปัจจัยบวกจากโอกาสเติบโตในกลุ่มธุรกิจรักษาโรคหัวใจก็ตาม,"หุ้น ABT ปัจจุบันอยู่ในแนวโน้มขาลงและมีทิศทางเชิงลบ (Sentiment -0.14) สะท้อนจากราคาที่ร่วงลงกว่า 15% ในรอบ 1 ปีประกอบกับค่า P/E ที่ยังค่อนข้างสูงที่ระดับ 29 เท่า 

อย่างไรก็ตาม ด้วยสัญญาณทางเทคนิคที่เข้าสู่เขตขายมากเกินไป (RSI Oversold) หุ้นตัวนี้จึงอาจเป็นโอกาสที่น่าสนใจสำหรับ **นักลงทุนระยะยาวหรือสายสวนตลาด (Contrarian)** ที่ต้องการหาจังหวะทยอยสะสมหุ้นพื้นฐานขนาดใหญ่เพื่อรอรอบการฟื้นตัว มากกว่านักลงทุนสายเก็งกำไรระยะสั้นตามโมเมนตัม"
ABBV,AbbVie Inc.,Health Care,Biotechnology,2026-03-15,219.68,-0.55,7.33,240.69,166.16,224.22,212.28,Uptrend,35.98,Neutral,23.75,388.43,92.69,13.63,2.37,315.0,6225.0,,61.16,4.19,0.33,0.75,ข่าวส่วนใหญ่เกี่ยวกับหุ้น AbbVie มีทิศทางเป็นบวกอย่างมาก โดยชี้ให้เห็นถึงสถานะการลงทุนที่แข็งแกร่ง การเติบโตที่ดี และศักยภาพในระยะยาว,"หุ้น ABBV อยู่ในเทรนด์ขาขึ้นและให้ผลตอบแทน 1 ปีที่น่าพอใจ มี Market Cap ขนาดใหญ่และ Sentiment เชิงบวก แต่มีค่า P/E ที่สูงมากถึง 92.69 บ่งชี้ถึงการประเมินมูลค่าที่ค่อนข้างตึงตัว แม้จะมี ROE ที่สูงโดดเด่นผิดปกติ

จึงน่าสนใจสำหรับนักลงทุนที่เน้นการเติบโตระยะยาวและยอมรับความผันผวนได้ โดยควรศึกษาปัจจัยที่ทำให้ P/E และ ROE สูงขนาดนี้อย่างละเอียดก่อนตัดสินใจลงทุน"
ACN,Accenture plc,Information Technology,IT Consulting & Other Services,2026-03-15,196.65,-14.66,-37.36,322.49,191.5,242.28,259.31,Downtrend,46.12,Neutral,27.17,121.95,16.27,13.19,12.09,332.0,25.02,25.69,70.73,7.61,1.25,0.12,ข่าวเกี่ยวกับหุ้น Accenture (ACN) มีทั้งแง่บวกที่แนะนำให้ซื้อและมีเป้าหมายราคาที่สูงขึ้น ไปจนถึงความกังวลเกี่ยวกับราคาที่อาจลดลงและผลงานที่แย่กว่าตลาดในช่วงที่ผ่านมา,"หุ้น ACN กำลังอยู่ในช่วงขาลงที่ชัดเจน (ราคาลดลง 37.36% ใน 1 ปี และ sentiment ติดลบ) แต่มีพื้นฐานแข็งแกร่งด้วย P/E 16.27 และ ROE สูงถึง 25.02%
จึงน่าสนใจสำหรับนักลงทุนระยะยาวที่มองหาหุ้นคุณภาพดีในราคาที่ถูกลงและรับความผันผวนได้ ไม่เหมาะกับนักเก็งกำไรระยะสั้นที่ต้องการผลตอบแทนรวดเร็ว."
ADBE,Adobe Inc.,Information Technology,Application Software,2026-03-15,249.32,-3.05,-34.01,420.68,246.68,286.35,339.47,Downtrend,51.78,Neutral,33.47,102.35,14.93,9.46,16.7,,58.77,58.22,24.45,7.21,1.53,-0.22,ข่าวส่วนใหญ่แสดงความกังวลและทำให้หุ้น Adobe ลดลงหลังจากการประกาศลาออกของ CEO แม้ว่าผลประกอบการโดยรวมจะดีก็ตาม,"แม้หุ้น ADBE จะอยู่ในช่วง Downtrend และราคาลดลงอย่างมีนัยสำคัญกว่า 34% ในหนึ่งปี แต่มีค่า P/E ที่ต่ำเพียง 14.93 เท่า พร้อม ROE ที่โดดเด่นถึง 58.77% บ่งชี้ถึงพื้นฐานธุรกิจที่แข็งแกร่งและอาจมีราคาที่น่าสนใจหลังการปรับฐาน.

หุ้นตัวนี้น่าสนใจสำหรับนักลงทุนระยะยาวที่รับความเสี่ยงได้สูงและกำลังมองหาโอกาสลงทุนในหุ้นคุณภาพที่อาจจะ undervalued หลังจากราคาปรับตัวลงมามาก เพื่อรอการกลับตัวของเทรนด์ในอนาคต."
AMD,"Advanced Micro Devices, Inc.",Information Technology,Semiconductors,2026-03-15,193.39,-9.45,97.12,264.33,78.21,216.13,190.82,Uptrend,48.11,Neutral,52.96,315.31,74.1,17.76,2.61,,7.08,6.36,34.64,4.27,2.02,-0.02,ข่าวเกี่ยวกับ AMD มีทั้งมุมมองบวกเกี่ยวกับศักยภาพด้าน AI และการลงทุนจากสถาบัน แต่ก็มีข่าวลบเกี่ยวกับการแข่งขันที่รุนแรงขึ้นและราคาหุ้นที่ปรับตัวลดลง,"หุ้น AMD ยังคงมีแนวโน้มขาขึ้นในระยะยาว (Uptrend) และมีการเติบโตที่น่าประทับใจตลอดปีที่ผ่านมา แม้จะมีการปรับฐานลงเล็กน้อยในเดือนล่าสุด

ด้วยค่า P/E ที่สูงถึง 74.1 และความผันผวนสูง หุ้นนี้น่าสนใจสำหรับ**นักลงทุนระยะยาวที่เน้นการเติบโตสูง (Growth Investor)** และสามารถยอมรับความเสี่ยงจากราคาที่แพงและความผันผวนได้"
AES,The AES Corporation,Utilities,Independent Power Producers & Energy Traders,2026-03-15,14.19,-13.69,22.16,17.28,9.27,15.0,13.33,Uptrend,28.12,Oversold,42.56,10.11,10.83,5.95,1.31,496.0,1.95,259.39,12.23,0.94,0.94,-0.4,ข่าวส่วนใหญ่เกี่ยวกับหุ้น AES แสดงผลงานที่ต่ำกว่ามาตรฐานและการประกาศข้อเสนอซื้อกิจการที่ 15 ดอลลาร์ต่อหุ้น ซึ่งส่งผลให้ราคาหุ้นลดลงอย่างมีนัยสำคัญ บ่งชี้ถึงภาพรวมที่เป็นลบ,"หุ้น AES มีแนวโน้มหลักเป็นขาขึ้น แต่ราคาร่วงแรงในเดือนที่ผ่านมาจนเข้าสู่ภาวะ Oversold (RSI 28.12) ซึ่งอาจเป็นจุดน่าสนใจสำหรับนักลงทุนที่มองหาจังหวะการกลับตัวระยะสั้น

อย่างไรก็ตาม ด้วยความผันผวนที่สูง (42.56%) และ ROE ที่ยังต่ำมาก (1.95%) หุ้นนี้จึงเหมาะกับนักลงทุนที่รับความเสี่ยงได้สูง เน้นการเทรดตามสัญญาณเทคนิคในระยะกลางถึงสั้น มากกว่าการลงทุนระยะยาวโดยอิงจากพื้นฐานที่แข็งแกร่ง"
AFL,Aflac Incorporated,Financials,Life & Health Insurance,2026-03-15,108.71,-5.99,5.68,116.85,96.54,111.19,107.05,Uptrend,30.22,Neutral,20.02,56.13,15.94,13.99,6.82,224.0,13.12,42.68,17.16,3.65,0.65,-0.2,ข่าวส่วนใหญ่บ่งชี้ถึงการขายหุ้นโดยผู้บริหารหรือสถาบัน ซึ่งส่งผลให้ภาพรวมเป็นลบเล็กน้อย แม้จะมีข่าวหนึ่งที่แสดงผลตอบแทนในอดีตที่ดีก็ตาม,"หุ้น AFL อยู่ในแนวโน้มขาขึ้น แต่ราคาลดลงเล็กน้อยในเดือนที่ผ่านมา (RSI ใกล้เขต Oversold) พร้อมพื้นฐานแข็งแกร่ง (P/E 15.94, ROE 13.12%) และเป็นหุ้นขนาดใหญ่ จึงน่าสนใจสำหรับนักลงทุนระยะยาวที่มองหาโอกาสซื้อหุ้นคุณภาพดีในช่วงที่ราคาอ่อนตัวเพื่อถือครอง."
A,"Agilent Technologies, Inc.",Health Care,Life Sciences Tools & Services,2026-03-15,111.51,-13.49,-4.2,156.92,98.71,130.51,129.65,Uptrend,21.71,Oversold,28.29,31.54,24.62,17.01,4.53,91.0,19.95,51.39,7.06,1.29,1.31,-0.44,"ข่าวส่วนใหญ่บ่งชี้ถึงมุมมองเชิงลบต่อหุ้น Agilent Technologies ทั้งจากการลดสถานะ, คำแนะนำไม่ให้ซื้อ, และข้อสงสัยเกี่ยวกับผลงาน, แม้จะมีข้อเสนอแนะว่าราคาอาจน่าสนใจหลังอ่อนตัวลง.","หุ้น Agilent Technologies (A) น่าสนใจสำหรับนักลงทุนที่มองหาโอกาส ""ซื้อเมื่อราคาตก"" เนื่องจากเป็นบริษัทที่มีพื้นฐานแข็งแกร่ง (ROE สูง) และอยู่ในเทรนด์ขาขึ้น แม้ราคาจะลดลงอย่างมากจน RSI บ่งชี้ภาวะ Oversold ในระยะสั้น

จึงเหมาะกับนักลงทุนที่รับความผันผวนได้และเน้นลงทุนระยะกลางถึงยาว เพื่อรอการฟื้นตัวจากการถูกขายมากเกินไปในปัจจุบัน"
APD,"Air Products and Chemicals, Inc.",Materials,Industrial Gases,2026-03-15,287.98,-1.76,0.96,295.18,229.09,272.4,270.2,Uptrend,55.68,Neutral,27.05,64.12,,20.53,-1.47,251.0,-1.67,101.99,12.21,-0.33,0.86,0.3,ข่าวส่วนใหญ่เกี่ยวกับ Air Products and Chemicals Inc. (APD) แสดงให้เห็นถึงแนวโน้มเชิงบวกเล็กน้อย โดยเฉพาะการที่ราคาหุ้นเพิ่มขึ้นและการได้รับการอัปเกรดจาก Wells Fargo.,"หุ้น APD แม้มีแนวโน้มขาขึ้นและเป็นบริษัทขนาดใหญ่ ($64.12B) แต่**การไม่มี P/E และ ROE ที่ติดลบ (-1.67%) บ่งชี้ถึงปัญหาด้านผลกำไร** ทำให้หุ้นดูมีความเสี่ยงสูง

นอกจากนี้ ยังมีความผันผวนสูง (27.05%) **จึงไม่น่าสนใจสำหรับนักลงทุนที่เน้นความมั่นคงหรือรับความเสี่ยงได้ต่ำ** และควรศึกษาข้อมูลเชิงลึกด้านผลประกอบการอย่างละเอียดก่อนตัดสินใจลงทุน"
ABNB,"Airbnb, Inc.",Consumer Discretionary,"Hotels, Resorts & Cruise Lines",2026-03-15,126.3,5.65,5.8,142.16,105.69,130.41,128.56,Uptrend,54.94,Neutral,36.27,75.72,31.34,21.76,4.03,,30.23,27.7,12.24,2.51,1.16,0.12,ข่าวโดยรวมผสมผสานระหว่างการลงทุนจากสถาบัน การตั้งคำถามถึงมูลค่าและผลงานของหุ้น และการวิเคราะห์การปรับตัวลงของราคาหุ้น ซึ่งมีแนวโน้มเป็นบวกเล็กน้อย,"หุ้น ABNB น่าสนใจสำหรับนักลงทุนที่มองหาหุ้นเติบโตในระยะกลางถึงยาว เนื่องจากอยู่ในเทรนด์ขาขึ้น มี ROE ที่โดดเด่นถึง 30.23% และมี P/E ที่สมเหตุสมผลสำหรับหุ้นกลุ่มนี้
แม้จะมีความผันผวนปานกลาง ก็เหมาะกับนักลงทุนที่รับความเสี่ยงได้และเน้นบริษัทที่มีพื้นฐานแข็งแกร่งและมีแนวโน้มการเติบโตต่อเนื่อง"
AKAM,"Akamai Technologies, Inc.",Information Technology,Internet Services & Infrastructure,2026-03-15,107.67,13.58,36.88,111.76,68.21,97.13,83.81,Uptrend,70.19,Overbought,34.86,15.6,35.07,14.17,3.07,,9.17,114.02,4.21,0.45,0.7,0.52,ภาพรวมของข่าวเกี่ยวกับ Akamai Technologies ส่วนใหญ่เป็นเชิงบวก โดยมีการกล่าวถึงผลงานที่ดี การปรับเป้าหมายราคาเพิ่มขึ้น และการเข้าซื้อหุ้น แม้จะมีข้อควรระวังบางประเด็น,"หุ้น AKAM น่าสนใจจากผลงานที่ดีและเทรนด์ขาขึ้นที่แข็งแกร่งในช่วง 1 เดือนและ 1 ปีที่ผ่านมา อย่างไรก็ตาม ด้วยค่า RSI ที่สูงมาก (Overbought), P/E ที่ค่อนข้างสูง และความผันผวนที่สูง หุ้นนี้จึง**เหมาะกับนักลงทุนที่รับความเสี่ยงได้สูงและเน้นการลงทุนระยะยาว** เพื่อหวังผลจากปัจจัยพื้นฐานและการเติบโตในอนาคตมากกว่าการเก็งกำไรระยะสั้นที่อาจมีความเสี่ยงจากการปรับฐาน."
